{
  "version": "1.0.0",
  "plugins": [
    {
      "id": "quick-settings",
      "name": "Quick Settings",
      "description": "Quick Settings plugin for CNC Controls application",
      "author": "Whttlr",
      "version": "1.0.0",
      "downloadUrl": "https://github.com/whttlr/plugin-registry/releases/download/quick-settings-v1.0.0/quick-settings.zip",
      "manifestUrl": "https://raw.githubusercontent.com/whttlr/plugin-registry/main/plugins/quick-settings/plugin.json",
      "category": "utility",
      "tags": [
        "modal",
        "cnc",
        "control"
      ],
      "minAppVersion": "1.0.0",
      "maxAppVersion": "2.0.0",
      "lastUpdated": "2025-10-30T15:30:00.000Z"
    }
  ],
  "categories": [
    "monitoring",
    "control",
    "visualization",
    "utility",
    "automation",
    "management"
  ],
  "lastUpdated": "2025-10-30T15:30:00.000Z"
}
